{"acquisition_unit_id":"bigsoldb_solubility","dataset_id":"bigsoldb_solubility-879f55f39db977e2","duplicate_index_path":"indexes/bigsoldb_solubility.duplicate-groups.jsonl.gz","duplicate_index_sha256":"ac73670af3abed54ac6fb4695131f4099be9fbe39d6076c5d0264a6bbdae9d83","endpoint_counts":{"solubility_log_s":103944},"evidence_class":"EXTERNAL_MEASURED","gzip_mtime":0,"identity_index_path":"indexes/bigsoldb_solubility.canonical-identity.jsonl.gz","identity_index_sha256":"41ba74573434ad036cde3af1f340dc5d0fdb8eb5bf01f032e3176742af084d20","normalized_path":"normalized/bigsoldb_solubility.jsonl.gz","normalized_sha256":"3ca9e1fce3444a2d8073dffbdca833a41f9259679bb5edc0c6c2485a8257ae3a","ordering":"archive_entry_then_source_row_number_ascending","quarantined":false,"raw_bytes":18280116,"raw_sha256":"879f55f39db977e295c705e304d011d89d6e10da1daaa3f069181108c1de38b0","record_count":103944,"rejection_count":0,"rejection_path":"rejections/bigsoldb_solubility.jsonl.gz","rejection_sha256":"ac73670af3abed54ac6fb4695131f4099be9fbe39d6076c5d0264a6bbdae9d83","rights_class":"DERIVATIVE_ALLOWED","schema":"amphora.normalized-dataset-manifest.v2","source_intent_id":"bigsoldb"}