{"acquisition_unit_id":"openpoly_counts","dataset_id":"openpoly_counts-9d6c34c0c1fc0b6a","duplicate_index_path":"indexes/openpoly_counts.duplicate-groups.jsonl.gz","duplicate_index_sha256":"ac73670af3abed54ac6fb4695131f4099be9fbe39d6076c5d0264a6bbdae9d83","endpoint_counts":{"endpoint_count_metadata":28},"evidence_class":"METADATA_ONLY","gzip_mtime":0,"identity_index_path":"indexes/openpoly_counts.canonical-identity.jsonl.gz","identity_index_sha256":"ac73670af3abed54ac6fb4695131f4099be9fbe39d6076c5d0264a6bbdae9d83","normalized_path":"normalized/openpoly_counts.jsonl.gz","normalized_sha256":"fecd513f4d11cd0da7ca4251cce82a542ac1edc2e0e3329b383fb256f64c04a9","ordering":"archive_entry_then_source_row_number_ascending","quarantined":false,"raw_bytes":849,"raw_sha256":"9d6c34c0c1fc0b6a757a5917f6c8617c374f16d0f2a1d5c3dd95c2941f640108","record_count":28,"rejection_count":0,"rejection_path":"rejections/openpoly_counts.jsonl.gz","rejection_sha256":"ac73670af3abed54ac6fb4695131f4099be9fbe39d6076c5d0264a6bbdae9d83","rights_class":"DERIVATIVE_ALLOWED","schema":"amphora.normalized-dataset-manifest.v2","source_intent_id":"openpoly"}