{"acquisition_unit_id":"polyomics_small_molecules","dataset_id":"polyomics_small_molecules-4dc408ff468f9b59","duplicate_index_path":"indexes/polyomics_small_molecules.duplicate-groups.jsonl.gz","duplicate_index_sha256":"ac73670af3abed54ac6fb4695131f4099be9fbe39d6076c5d0264a6bbdae9d83","endpoint_counts":{"computed_small_molecule_property":28159},"evidence_class":"COMPUTED","gzip_mtime":0,"identity_index_path":"indexes/polyomics_small_molecules.canonical-identity.jsonl.gz","identity_index_sha256":"ac73670af3abed54ac6fb4695131f4099be9fbe39d6076c5d0264a6bbdae9d83","normalized_path":"normalized/polyomics_small_molecules.jsonl.gz","normalized_sha256":"9850530553585373bca9cb0fddf3181547f8e138b0b0000e8f1b7e36bd3079e8","ordering":"archive_entry_then_source_row_number_ascending","quarantined":false,"raw_bytes":104746544,"raw_sha256":"4dc408ff468f9b59b1c59b40efbc8a1750ca0d0c4bcf89ebf8268442553626ac","record_count":28159,"rejection_count":0,"rejection_path":"rejections/polyomics_small_molecules.jsonl.gz","rejection_sha256":"ac73670af3abed54ac6fb4695131f4099be9fbe39d6076c5d0264a6bbdae9d83","rights_class":"DERIVATIVE_ALLOWED","schema":"amphora.normalized-dataset-manifest.v2","source_intent_id":"polyomics"}