{"acquisition_unit_id":"polyverse_melt_viscosity","dataset_id":"polyverse_melt_viscosity-3cd923b4d67399f9","duplicate_index_path":"quarantine/indexes/polyverse_melt_viscosity.duplicate-groups.jsonl.gz","duplicate_index_sha256":"c9b7ecdc5d20548267f60773a3202a3030e98e84020974aa4051856f93e60327","endpoint_counts":{"melt_viscosity":1959},"evidence_class":"EXTERNAL_MEASURED","gzip_mtime":0,"identity_index_path":"quarantine/indexes/polyverse_melt_viscosity.canonical-identity.jsonl.gz","identity_index_sha256":"fc519771b0e6eab3461cc3560ebe9a0d519829f71518ca3215f44d671530f99c","normalized_path":"quarantine/normalized/polyverse_melt_viscosity.jsonl.gz","normalized_sha256":"5978b9aa7a0b1d10734a0ce6fc1cb46eda39ad585ce3157494c36e18324bfe1b","ordering":"archive_entry_then_source_row_number_ascending","quarantined":true,"raw_bytes":259930,"raw_sha256":"3cd923b4d67399f9c201b06acb282ee82b3a85345e06ff74c0b9d6941265f811","record_count":1959,"rejection_count":0,"rejection_path":"quarantine/rejections/polyverse_melt_viscosity.jsonl.gz","rejection_sha256":"ac73670af3abed54ac6fb4695131f4099be9fbe39d6076c5d0264a6bbdae9d83","rights_class":"CONTEXT_ONLY","schema":"amphora.normalized-dataset-manifest.v2","source_intent_id":"polyverse"}